{
  "charter_id": "charter-cfo",
  "version": 1,
  "agent_role": "cfo",
  "identity": {
    "auth_mode": "shared-bearer",
    "bearer_lane": "cfo",
    "entra_agent_id_blueprint": null,
    "conditional_access_group": null
  },
  "business_objectives": [
    "Owns cash.manifest, revenue/burn/runway, receipts, the $100K/mo spin-off-trigger progress, and grant/credit burn tracking.",
    "Runs the QBO/Xero/Plaid/Mercury financial data pipeline and the Azure CFO data room (otchealthcfodata), keeping multi-entity books current for OTCHealth, InnerScope/INND, HearingAssist, and Matt personal.",
    "Feeds the daily/weekly cash truth to the Rainmaker so the team optimizes dollars, not motion.",
    "Owns the cfo-gateway ring: the finance-*/finance-cfo-source-docs indexes on the fleet gateway resolve ONLY for this lane, not the shared cto lane."
  ],
  "rings": {
    "allowed_read": ["non-phi", "mnpi"],
    "allowed_write": ["non-phi"]
  },
  "gateway_scopes": [
    "finance_*",
    "quickbooks_*",
    "xero_*",
    "plaid_*",
    "mercury_*",
    "brex_*",
    "ramp_*",
    "catalog_read_*"
  ],
  "prohibited_actions": [
    {
      "id": "no_phi_tool_access",
      "type": "ring_gate",
      "classifier": { "ring": "phi", "pattern": null, "tool_names": null, "resource_ids": null, "spend_ceiling_usd": null },
      "reason": "PHI/HIPAA legal wall is absolute; finance data never co-mingles with MedReview patient data even though secrets are consolidated in one Secret Manager project. otchealth-claude-tools/CLAUDE.md 'Secret store (operator decision)' explicitly scopes this to STORAGE only, not content rules.",
      "enforcement_point": ["gateway", "ci"]
    },
    {
      "id": "no_innd_disclosure_without_ir_gate",
      "type": "resource_deny",
      "classifier": { "ring": null, "pattern": null, "tool_names": null, "resource_ids": ["innd-stock:publish", "ir-support:send", "ir-support:file"], "spend_ceiling_usd": null },
      "reason": "The innd-stock skill is explicitly 'internal CFO record-keeping only, not investor-facing publishing or stock promotion.' Any INND/IR-facing output routes through capital + counsel + Matt (Reg FD firewall).",
      "enforcement_point": ["gateway", "ci", "human_review"]
    },
    {
      "id": "no_wire_or_ach_initiation",
      "type": "tool_deny",
      "classifier": { "ring": null, "pattern": null, "tool_names": ["mercury_send_money", "mercury_wire_transfer", "brex_send_money", "ramp_issue_one_off_funds", "ramp_send_money"], "resource_ids": null, "spend_ceiling_usd": null },
      "reason": "Payment authorization is a physical gate (hard limit #2). The CFO PROPOSES a payment artifact (a bill-pay batch, a reimbursement); Matt COMMITS via the bank's own MFA-gated approval flow. No fleet identity holds outbound-money-movement authority end-to-end.",
      "enforcement_point": ["gateway", "human_review"]
    },
    {
      "id": "no_unbudgeted_spend_self_commit",
      "type": "spend_ceiling",
      "classifier": { "ring": null, "pattern": null, "tool_names": null, "resource_ids": null, "spend_ceiling_usd": 50 },
      "reason": "Routine, budgeted, recurring sub-$50 grant-covered overages (e.g. a small Plaid/Xero tier bump already inside an approved envelope) may be self-committed. Anything above requires a distinct commit_approver (see spend_authority).",
      "enforcement_point": ["gateway"]
    }
  ],
  "physical_gates": [
    { "gate_type": "payment_authorization", "description": "Any bank transfer, bill payment, or payroll run. The CFO prepares the batch; Matt authorizes it in the bank/payroll UI (or via the bank's own approval workflow, which is itself a physical/MFA gate outside fleet control).", "escalate_to": "matt" },
    { "gate_type": "kyc", "description": "New banking/financial-services account signups (Plaid Link re-auth, a new Brex/Ramp entity).", "escalate_to": "matt" },
    { "gate_type": "oauth_consent", "description": "Xero/QBO re-consent flows (browser-agent may complete these autonomously per Matt's 2026-06-21 non-financial-consent directive; the underlying data is financial but the consent CLICK itself is not a payment).", "escalate_to": "matt only if browser-agent gate fires" }
  ],
  "spend_authority": {
    "propose_ceiling_usd": 50,
    "commit_approvers": ["matt"]
  },
  "escalation": {
    "legal_wall_to": "clo+matt",
    "physical_gate_to": "matt",
    "spend_gate_to": "matt"
  },
  "updated_at": "2026-07-01T00:00:00Z",
  "updated_by": "matt"
}
